{
  "version": 0,
  "architecture": "x86_64",
  "source_files": {
    "boot": "kernel/arch/x86_64/boot.asm",
    "privilege_transition": "kernel/arch/x86_64/privilege_transition.asm",
    "layout": "kernel/arch/x86_64/runtime_layout.inc",
    "linker": "linker/kernel.ld"
  },
  "execution_point": {
    "after_marker": "KOZO_USER_RESPONSE_COPY_OUT_OK",
    "before_marker": "KOZO_FIXED_USER_REQUEST_OK",
    "return_vector": "0x81",
    "ring3_resume_count": 1,
    "second_gate_count": 1,
    "terminal_continuation": "privilege_ring0_continuation",
    "continuation_owner": "active_odin_call_frame"
  },
  "transaction_phases": {
    "owner": "kernel",
    "storage_symbol": "fixed_user_transaction_phase",
    "storage_end_symbol": "fixed_user_transaction_phase_end",
    "size_bytes": 8,
    "alignment_bytes": 8,
    "request_pending": 0,
    "response_ready": 1,
    "consumed": 2,
    "user_accessible": false
  },
  "response_consumer": {
    "start_symbol": "user_response_consumer_start",
    "interrupt_return_symbol": "user_response_consumer_interrupt_return",
    "end_symbol": "user_response_consumer_end",
    "virtual_address_rule": "USER_PROBE_CODE_VA + linked_symbol_offset",
    "fixed_user_rsp": "0x0000400000002ff0",
    "user_code_selector": "0x23",
    "user_data_selector": "0x1b",
    "sanitized_rflags": "0x2",
    "resume_instruction": "iretq",
    "gate_instruction": "int 0x81",
    "unexpected_return_instruction": "ud2"
  },
  "response": {
    "virtual_address": "0x0000400000001080",
    "size_bytes": 88,
    "alignment_bytes": 8,
    "physical_backing_symbol": "user_probe_data_start",
    "version": 1,
    "request_id": 2,
    "status": 0,
    "response_size": 88,
    "sequence": 1,
    "current_runtime_stage": 5,
    "proven_stage_mask": 63,
    "boot_memory_region_size": 4096,
    "controlled_loop_iteration_limit": 3,
    "controlled_loop_final_count": 3,
    "controlled_loop_final_accumulator": 6,
    "feature_mask": 127,
    "reserved_fields_zero": true
  },
  "consumption_record": {
    "virtual_address": "0x0000400000001100",
    "page_offset": 256,
    "size_bytes": 48,
    "alignment_bytes": 8,
    "physical_backing_symbol": "user_probe_data_start",
    "version": 1,
    "record_id": 1,
    "record_size": 48,
    "success_validation_status": 0,
    "fields": [
      {"name": "version", "offset": 0, "size": 4},
      {"name": "record_id", "offset": 4, "size": 4},
      {"name": "record_size", "offset": 8, "size": 4},
      {"name": "validation_status", "offset": 12, "size": 4},
      {"name": "sequence", "offset": 16, "size": 8},
      {"name": "selected_status_value", "offset": 24, "size": 8},
      {"name": "response_digest", "offset": 32, "size": 8},
      {"name": "reserved", "offset": 40, "size": 8}
    ]
  },
  "kernel_shadow": {
    "start_symbol": "fixed_user_consumption_shadow",
    "end_symbol": "fixed_user_consumption_shadow_end",
    "size_bytes": 48,
    "alignment_bytes": 8,
    "user_accessible": false,
    "writable": true,
    "executable": false
  },
  "ring3_response_checks": [
    "CPL equals 3",
    "fixed user RSP matches",
    "bounded stack sentinel survives",
    "version matches",
    "request ID matches",
    "status matches",
    "response size matches",
    "sequence matches",
    "current runtime stage matches",
    "proven stage mask matches",
    "boot memory region size matches",
    "controlled loop iteration limit matches",
    "controlled loop final count matches",
    "controlled loop final accumulator matches",
    "feature mask matches",
    "reserved fields are zero"
  ],
  "second_frame_validation": {
    "saved_rip_fixed": true,
    "saved_rsp_fixed": true,
    "saved_selectors_fixed": true,
    "saved_rflags_sanitized": true,
    "current_cpl_zero": true,
    "tss_rsp0_stack_required": true
  },
  "response_revalidation": {
    "complete_span_required": true,
    "mapping_policy_required": true,
    "physical_backing_required": true,
    "all_eleven_qwords_match_shadow": true,
    "semantic_field_validation_required": true
  },
  "record_copy": {
    "source_fixed": true,
    "destination_fixed": true,
    "user_supplied_pointer": false,
    "user_supplied_length": false,
    "copy_size_bytes": 48,
    "complete_copy_before_validation": true
  },
  "clearing": {
    "user_response_bytes": 88,
    "user_record_bytes": 48,
    "kernel_response_shadow_bytes": 88,
    "kernel_consumption_shadow_bytes": 48,
    "kernel_verify_bytes": 88,
    "zero_readback_required": true
  },
  "phase_reset": {
    "required_before_odin": false,
    "required_before_return_to_odin": true,
    "reset_value": 0,
    "readback_required": true
  },
  "marker_order": [
    "KOZO_RUNTIME_LOOP_EXIT_OK",
    "KOZO_USER_RESPONSE_COPY_OUT_OK",
    "KOZO_RING3_RESPONSE_RESUME",
    "KOZO_USER_RESPONSE_CONSUMED_OK",
    "KOZO_FIXED_USER_RESPONSE_OK",
    "KOZO_FIXED_USER_REQUEST_OK",
    "KOZO_RING3_PROBE_OK",
    "KOZO_RING0_RETURN_OK",
    "KOZO_CAPABILITY_DISPATCH_ENTER"
  ],
  "marker_ownership": {
    "KOZO_RING3_RESPONSE_RESUME": "Ring0 after preserving and revalidating the fixed response and constructing a sanitized resume boundary",
    "KOZO_USER_RESPONSE_CONSUMED_OK": "Ring0 after validating the second CPL3 frame, response, and fixed consumption record",
    "KOZO_FIXED_USER_RESPONSE_OK": "Ring0 after clearing every response-stage buffer and validating the CONSUMED phase"
  },
  "failure_statuses": {
    "success": 0,
    "phase_invalid": 18,
    "resume_frame_invalid": 19,
    "span_invalid": 20,
    "content_invalid": 21,
    "record_copy_failed": 22,
    "record_invalid": 23,
    "clear_failed": 24,
    "continuation_invalid": 25
  },
  "halt_behavior": {
    "failure_target": "boot_terminal_halt",
    "later_success_markers_forbidden_after_failure": true,
    "terminal_halt_remains_authoritative": true
  },
  "claim_boundary": {
    "proves": [
      "Ring0 resumed one fixed Ring3 response consumer",
      "Ring3 validated every fixed response field",
      "Ring3 wrote one fixed response-consumption record",
      "Ring3 invoked the existing int 0x81 gate a second time",
      "Ring0 validated the second CPL3 frame and complete 88-byte response",
      "Ring0 copied and validated exactly 48 consumption bytes",
      "Ring0 cleared response-stage buffers, reset the phase, and returned to active Odin"
    ],
    "does_not_prove": [
      "persistent Ring3 execution",
      "general syscall ABI",
      "safe execution of arbitrary hostile user code",
      "process isolation",
      "production readiness"
    ]
  },
  "non_goals": [
    "persistent Ring3 execution",
    "user event loop",
    "multiple request transactions",
    "general syscall ABI",
    "syscall instruction support",
    "sysret",
    "arbitrary request identifiers",
    "arbitrary response types",
    "user-provided pointers",
    "user-provided lengths",
    "variable-sized records",
    "general copy_from_user",
    "general copy_to_user",
    "page-fault recovery",
    "process model behavior",
    "scheduler behavior",
    "dynamic virtual memory",
    "Linux compatibility",
    "POSIX compatibility",
    "production readiness"
  ]
}
